{"$schema": "https://json-schema.org/draft/2020-12/schema", "type": "object", "properties": {"title": {"type": "string"}, "opening_line": {"type": "string", "description": "에피 오프닝 롤 브리핑(1~2문장): 누구+맥락+지금 상황 간결·명확. 실재하는 처지만, 플레이어 행동 서술 금지"}, "poster": {"type": "object", "properties": {"place": {"type": "string", "description": "DTS 장소(개방) — 씬 배경과 같은 어휘"}, "time_of_day": {"type": "string", "description": "DTS 시간대(닫힌)"}, "mood": {"type": "string", "description": "DTS 무드(닫힌)"}}, "required": ["place", "time_of_day", "mood"], "description": "포스터 키비주얼 — 에피 전체를 대표하는 한 컷의 배경 축"}, "level": {"type": "string"}, "protagonist": {"type": "string", "description": "화자 캐릭터 id(=화자 base_name)"}, "characters": {"type": "array", "items": {"type": "object", "properties": {"id": {"type": "string"}, "display_name": {"type": "string"}, "is_speaker": {"type": "boolean"}, "outfit": {"default": null, "description": "복장 — **굵게 고른다.** 대부분은 `캐주얼`·`정장`·`운동복`·`아웃도어` 같은 일반 드레스코드로 충분하다. **직업이 화면에 드러나야 하는 경우에만** 유니폼을 쓴다(의사·약사·미용사·바리스타·웨이터·점원·상담원·경비원·기사·코치·작업복 같은 것). 🛑 복장이 하나 늘면 캐릭터 수만큼 일러가 곱해진다", "anyOf": [{"type": "string"}, {"type": "null"}]}}, "required": ["id", "display_name", "is_speaker"]}}, "scenes": {"type": "array", "items": {"type": "object", "properties": {"id": {"type": "string"}, "bg_image": {"type": "object", "properties": {"place": {"type": "string", "description": "배경 장소·매체(개방 축 — dedup 대상, 닫힌 목록 아님). 대면=장소, 비대면=매체 자체"}, "spot": {"description": "배경 자리(개방 축 — dedup 대상). 장소 안의 특정 자리(창가석·카운터·창구). 특정할 자리가 없으면 비운다. 원격(매체)은 항상 비움", "anyOf": [{"type": "string"}, {"type": "null"}]}, "time_of_day": {"type": "string", "description": "DTS 시간대 축(닫힌)"}}, "required": ["place", "time_of_day"]}, "bgm": {"type": "object", "properties": {"genre": {"type": "string", "description": "DTS BGM 장르(닫힌)"}, "tempo": {"type": "string", "description": "DTS BGM 템포(닫힌)"}}, "required": ["genre", "tempo"]}, "mood": {"type": "string", "description": "DTS 무드(닫힌). 씬 공유 축 — bg_image·bgm 분위기가 이 값을 공유"}, "contents": {"type": "array", "items": {"oneOf": [{"type": "object", "properties": {"type": {"type": "string", "const": "text"}, "id": {"type": "string"}, "characterId": {"description": "지문 초점 인물 1명(연출). 배경만이면 null(키를 생략해도 같게 본다)", "anyOf": [{"type": "string"}, {"type": "null"}]}, "l1": {"type": "string", "description": "지문(한국어·문어체·소설). 음성 없음"}, "sfx": {"description": "1회성 효과음 자유태그(행동/사건 비트만, 뚜렷한 소리 있을 때). 공백 없는 단일 토큰. 없으면 null", "anyOf": [{"type": "string"}, {"type": "null"}]}}, "required": ["type", "id", "l1"]}, {"type": "object", "properties": {"type": {"type": "string", "const": "dialogue"}, "id": {"type": "string"}, "speaker": {"type": "string", "description": "characters[].id. 화면 일러도 이 speaker 자동"}, "text": {"type": "string", "description": "대사 L2(영어·구어체)"}, "l1": {"type": "string", "description": "대사 번역(한국어·자연 구어)"}, "expression": {"type": "string", "enum": ["기쁨", "분노", "불안", "슬픔", "애정"], "description": "이 대사 화자의 감정(닫힌 축 5종: 기쁨/분노/불안/슬픔/애정). beat별 직접 판단(상속·override 없음). 대화는 화자마다 감정이 달라도 정상"}, "sfx": {"description": "1회성 효과음 자유태그(행동/사건 비트만, 뚜렷한 소리 있을 때). 공백 없는 단일 토큰. 없으면 null", "anyOf": [{"type": "string"}, {"type": "null"}]}}, "required": ["type", "id", "speaker", "text", "l1", "expression"]}]}}}, "required": ["id", "bg_image", "bgm", "mood", "contents"]}}, "atoms": {"type": "array", "items": {"type": "object", "properties": {"line_id": {"type": "string", "description": "scenes 의 dialogue content id 참조"}, "elements": {"type": "array", "items": {"type": "object", "properties": {"span": {"type": "string", "minLength": 1, "description": "드릴 가능한 최소 학습 단위(대사 전체 or 문장)"}, "l1": {"type": "string"}, "tokens": {"type": "array", "items": {"type": "object", "properties": {"t": {"type": "string"}, "l1": {"type": "string"}, "free": {"description": "위치자유 부가어면 true. 🛑 아니면 **키를 아예 생략**한다(null 을 쓰지 않는다)", "anyOf": [{"type": "boolean"}, {"type": "null"}]}, "freeGroup": {"description": "같은 구끼리 같은 정수. 🛑 해당 없으면 **키를 아예 생략**한다(null 을 쓰지 않는다)", "anyOf": [{"type": "number"}, {"type": "null"}]}}, "required": ["t", "l1"]}, "description": "읽기보조 전량 분해(구두점 제거한 단어)"}, "function": {"type": "array", "items": {"type": "string"}, "description": "[화행] 발화의 의사소통 행위(무엇을 하는 발화인가). 상위 화행까지만. 형태 이름 금지. 최소 1개"}, "grammar": {"type": "array", "items": {"type": "string"}, "description": "[문법] 문장이 담은 문법·형태 규칙. 문법 초점 뚜렷할 때만(없으면 []). distractor가 가르치는 규칙과 정합"}, "discourse": {"type": "array", "items": {"type": "string"}, "description": "[담화표지] 발화를 잇고 조율하는 장치(빼도 명제는 그대로). 화제전환·동의유도·완충 등(없으면 [])"}, "level": {"type": "string", "description": "A1/A2 등"}, "distractors": {"type": "array", "items": {"type": "object", "properties": {"token": {"type": "string"}, "hint": {"anyOf": [{"type": "string"}, {"type": "null"}]}, "for": {"anyOf": [{"type": "string"}, {"type": "null"}]}, "kind": {"anyOf": [{"type": "string", "enum": ["contrast", "trap", "form", "chunk", "nuance", "order", "discourse"]}, {"type": "null"}]}}, "required": ["token"]}, "description": "오답 토큰. for = 이 오답이 겨냥한 **정답 문장 안의 토큰**(그 자리에 들어갈 정답 단어를 그대로).\nhint 는 그 토큰과의 차이를 짚는 문구. 특정 자리를 겨냥하지 않은 일반 오답이면 for=null, hint=null, kind=null.\n\nkind = 이 오답이 가르치는 것의 종류. **개수를 늘리지 말고 종류를 다양하게 하라.**\n- contrast: 유의어·인접 표현 구분 (until→by: 완료 기한엔 by, until은 '그때까지 계속')\n- trap: 학습자가 거의 반드시 걸리는 고빈도 오류 (should have had→will be: 과거 후회 vs 미래 예정)\n- form: 어형·굴절 (us→we 주격, having→have 원형, an→a)\n- chunk: 연어·관용을 통째로 (end of→the end of)\n- nuance: 같은 자리에 다 들어가지만 뜻이 다른 것 (will→should: 단정 vs 부드러운 예상)\n- discourse: 앞 발화 맥락에 기대는 것 (it→them)\n  (order=어순은 여기 쓰지 않는다 — 칩 하나로 표현할 수 없다. expected_errors 로 낸다.)\n\n⚠️ **form 편중 금지.** 3인칭 s·관사·-ing 류(form)는 만들기 쉬워 쏠리기 쉽다. 아톰당 **최대 1개**.\n⚠️ 나머지는 문장이 실제로 그 지점을 품고 있을 때만 만든다. 없는 걸 지어내지 말 것 —\n   억지 trap 보다 form 하나가 낫다. 해당 없으면 그 유형은 비운다.\n⚠️ trap 이 가장 값어치 있다. 이 문장에서 학습자가 실제로 틀릴 만한 게 있으면 그것부터 만든다."}, "expected_errors": {"type": "array", "items": {"type": "object", "properties": {"wrong": {"type": "array", "items": {"type": "string"}}, "right": {"type": "array", "items": {"type": "string"}}, "kind": {"type": "string", "enum": ["contrast", "trap", "form", "chunk", "nuance", "order", "discourse"]}, "hint": {"type": "string"}}, "required": ["wrong", "right", "kind", "hint"]}, "description": "학습자가 **이 문장에서 실제로 만들 법한 틀린 배열**. 칩 하나로는 표현할 수 없는 오류만 여기 담는다.\n- wrong: 학습자가 놓을 것으로 예상하는 **연속된 나열**\n- right: 그 자리에 들어가야 하는 **정답 토큰의 연속 구간**(정답 문장에 그대로 있는 나열)\n- kind: order(어순) 또는 trap(다중 토큰 고빈도 오류). 그 외 유형은 distractor 로 충분하다.\n- hint: 왜 틀렸는지 한 줄(distractor.hint 와 같은 톤)\n\n⚠️ **wrong 의 모든 토큰은 정답 토큰이거나 distractors 에 있는 칩이어야 한다.** 워드뱅크에\n   없는 단어를 쓰면 학습자가 그 배열을 만들 수 없어 죽은 항목이 된다. **칩을 새로 만들지 말 것** —\n   이 필드는 조합을 선언할 뿐이고, 칩이 필요하면 distractors 에 1어절로 추가한다.\n⚠️ **어순은 정답 토큰만으로 표현된다**(wrong 이 right 의 순열). 예: 정답 ... how old he is →\n   wrong:[how,old,is,he] right:[how,old,he,is] kind:order hint:'안긴 의문문은 주어+동사 순서예요'\n⚠️ **맥락 앵커를 끼워 넣지 말 것.** wrong/right 양쪽에 **같은 자리로** 들어가는 토큰은 빼고 **실제로\n   달라지는 부분만** 적는다. wrong:[you,say,always] right:[you,always,say] ✗ →\n   wrong:[say,always] right:[always,say] ○. 앵커를 남기면 제자리인 단어까지 틀린 것으로 칠해진다.\n⚠️ **없으면 빈 배열.** 억지로 만들지 말 것 — 이 문장이 그 오류를 실제로 유발하지 않으면 비운다.\n   0~2개면 충분하다."}, "glosses": {"type": "array", "items": {"type": "object", "properties": {"lemma": {"type": "string", "description": "원형/사전형(SRS 학습 카드용). 굴절·인칭 벗긴 형태. 소문자(고유명사·I 예외)"}, "surface_form": {"type": "string", "description": "문장에 실제 나타난 형태(호버 매칭용). lemma와 같아도 채움. 소문자 표기 — 단 고유명사·'I'는 대문자 유지, 문장 첫머리라 대문자가 된 건 소문자로"}, "l1": {"type": "string"}}, "required": ["lemma", "surface_form", "l1"]}, "description": "재사용 학습 어휘·표현만(기능어·자명한 것 제외)"}, "explain": {"type": "string"}}, "required": ["span", "l1", "tokens", "function", "grammar", "discourse", "level", "distractors", "expected_errors", "glosses", "explain"]}, "description": "학습 단위 — 뽑을 게 없으면 빈 배열"}}, "required": ["line_id", "elements"]}}}, "required": ["title", "opening_line", "poster", "level", "protagonist", "characters", "scenes", "atoms"]}