{"title": "점심시간 카페 주문", "opening_line": "점심시간, 강배는 동료 도현과 회사 앞 카페에 들렀다. 메뉴판 앞에서 뭘 시킬지 고민하던 참인데, 곧 자기 차례가 온다.", "poster": {"place": "카페", "time_of_day": "낮", "mood": "활기찬"}, "level": "A2", "protagonist": "강배", "characters": [{"id": "강배", "display_name": "강배", "is_speaker": true, "outfit": "캐주얼"}, {"id": "도현", "display_name": "도현", "is_speaker": true, "outfit": "정장"}, {"id": "하린", "display_name": "하린", "is_speaker": true, "outfit": "바리스타"}], "scenes": [{"id": "s1", "bg_image": {"place": "카페", "spot": "주문대", "time_of_day": "낮"}, "bgm": {"genre": "시티팝", "tempo": "빠른"}, "mood": "활기찬", "contents": [{"type": "text", "id": "s1_t1", "characterId": "강배", "l1": "점심시간 카페 안은 사람들로 북적였다. 메뉴판 위 조명이 빛나고, 원두 갈리는 소리가 리듬처럼 깔린다. 강배는 도현과 나란히 서서 메뉴판을 훑어본다.", "sfx": null}, {"type": "dialogue", "id": "s1_l1", "speaker": "도현", "text": "So, what are you getting? I can never decide here.", "l1": "그래서, 뭐 시킬 거예요? 여긴 항상 고민되네요.", "expression": "기쁨", "sfx": null}, {"type": "dialogue", "id": "s1_l2", "speaker": "강배", "text": "I think I'll just get an iced Americano. Keeps it simple.", "l1": "그냥 아이스 아메리카노 시킬 것 같아요. 간단하게.", "expression": "기쁨", "sfx": null}, {"type": "text", "id": "s1_t2", "characterId": "도현", "l1": "도현이 메뉴판 아래쪽을 손끝으로 짚으며 눈썹을 살짝 찌푸린다. 뭔가 더 끌리는 게 있는 눈치다.", "sfx": null}, {"type": "dialogue", "id": "s1_l3", "speaker": "도현", "text": "Actually, I might try that new caramel latte. It looks pretty good in the picture.", "l1": "사실, 저 새로 나온 카라멜 라떼 한번 먹어볼까 해요. 사진에서 보니까 꽤 맛있어 보여요.", "expression": "기쁨", "sfx": null}, {"type": "dialogue", "id": "s1_l4", "speaker": "강배", "text": "Go for it. If it's bad, you can always blame the picture.", "l1": "한번 해봐요. 맛없으면 사진 탓하면 되죠, 뭐.", "expression": "기쁨", "sfx": null}]}, {"id": "s2", "bg_image": {"place": "카페", "spot": "주문대", "time_of_day": "낮"}, "bgm": {"genre": "시티팝", "tempo": "빠른"}, "mood": "활기찬", "contents": [{"type": "text", "id": "s2_t1", "characterId": "하린", "l1": "줄이 짧아지고, 어느새 두 사람 차례가 되었다. 앞치마를 두른 하린이 밝은 목소리로 두 사람을 맞이한다.", "sfx": "자동문소리"}, {"type": "dialogue", "id": "s2_l1", "speaker": "하린", "text": "Hi there! What can I get started for you two?", "l1": "안녕하세요! 두 분 뭐 드릴까요?", "expression": "기쁨", "sfx": null}, {"type": "dialogue", "id": "s2_l2", "speaker": "강배", "text": "I'll have an iced Americano, please. Large, if that's okay.", "l1": "저는 아이스 아메리카노 주세요. 괜찮으면 큰 사이즈로요.", "expression": "기쁨", "sfx": null}, {"type": "dialogue", "id": "s2_l3", "speaker": "하린", "text": "Sure thing. And for you?", "l1": "네, 알겠습니다. 손님은요?", "expression": "기쁨", "sfx": null}, {"type": "text", "id": "s2_t2", "characterId": "도현", "l1": "도현이 잠깐 메뉴판을 다시 올려다본다. 마음을 정한 듯 고개를 끄덕인다.", "sfx": null}, {"type": "dialogue", "id": "s2_l4", "speaker": "도현", "text": "Could I get the caramel latte? Medium size, please.", "l1": "카라멜 라떼 주시겠어요? 중간 사이즈로요.", "expression": "기쁨", "sfx": null}, {"type": "dialogue", "id": "s2_l5", "speaker": "하린", "text": "Got it. Will that be for here or to go?", "l1": "알겠습니다. 매장에서 드세요, 아니면 포장이세요?", "expression": "기쁨", "sfx": null}, {"type": "dialogue", "id": "s2_l6", "speaker": "강배", "text": "For here, please. We're just on our lunch break.", "l1": "매장에서 먹을게요. 저희 지금 점심시간이라서요.", "expression": "기쁨", "sfx": null}]}, {"id": "s3", "bg_image": {"place": "카페", "spot": "테이블", "time_of_day": "낮"}, "bgm": {"genre": "시티팝", "tempo": "중간"}, "mood": "편안", "contents": [{"type": "text", "id": "s3_t1", "characterId": "도현", "l1": "잠시 후, 진동벨이 울리고 두 사람은 음료를 받아 창가 테이블에 자리를 잡는다. 도현이 빨대를 꽂고 한 모금 마신 뒤 눈을 크게 뜬다.", "sfx": "딸그락소리"}, {"type": "dialogue", "id": "s3_l1", "speaker": "도현", "text": "Oh wow, this is actually really good. You should've gotten one too.", "l1": "와, 이거 진짜 맛있네요. 강배 씨도 하나 시킬걸 그랬어요.", "expression": "기쁨", "sfx": null}, {"type": "dialogue", "id": "s3_l2", "speaker": "강배", "text": "Maybe next time. I'm a creature of habit, I guess.", "l1": "다음엔 그래야겠네요. 저는 원래 하던 대로 하는 편이라서요, 아마.", "expression": "기쁨", "sfx": null}]}], "atoms": [{"line_id": "s1_l1", "elements": [{"span": "So, what are you getting? I can never decide here.", "l1": "그래서, 뭐 시킬 거예요? 여긴 항상 고민되네요.", "tokens": [{"t": "So", "l1": "그래서", "free": true, "freeGroup": 1}, {"t": "what", "l1": "무엇을"}, {"t": "are", "l1": "~이다"}, {"t": "you", "l1": "당신"}, {"t": "getting", "l1": "주문하다/얻다"}, {"t": "I", "l1": "나"}, {"t": "can", "l1": "~할 수 있다"}, {"t": "never", "l1": "결코 ~않다"}, {"t": "decide", "l1": "결정하다"}, {"t": "here", "l1": "여기서"}], "function": ["ask_preference"], "grammar": ["present_progressive"], "discourse": ["discourse_opener"], "level": "A2", "distractors": [{"token": "get", "hint": "지금 뭘 정할지 물어보는 진행형이라 getting이 맞아요", "for": "getting", "kind": "form"}, {"token": "ever", "hint": "'절대 못한다'는 뜻이라 never가 맞아요", "for": "never", "kind": "contrast"}], "expected_errors": [], "glosses": [{"lemma": "can never decide", "surface_form": "can never decide", "l1": "도무지 결정을 못 하다"}], "explain": "메뉴를 앞에 두고 상대에게 뭘 주문할지 물어보는 상황."}]}, {"line_id": "s1_l2", "elements": [{"span": "I think I'll just get an iced Americano. Keeps it simple.", "l1": "그냥 아이스 아메리카노 시킬 것 같아요. 간단하게.", "tokens": [{"t": "I", "l1": "나"}, {"t": "think", "l1": "생각하다"}, {"t": "I'll", "l1": "나는 ~할 것이다"}, {"t": "just", "l1": "그냥"}, {"t": "get", "l1": "주문하다"}, {"t": "an", "l1": "하나의"}, {"t": "iced", "l1": "아이스"}, {"t": "Americano", "l1": "아메리카노"}, {"t": "Keeps", "l1": "유지하다"}, {"t": "it", "l1": "그것을"}, {"t": "simple", "l1": "간단하게"}], "function": ["express_opinion"], "grammar": [], "discourse": ["hedge"], "level": "A2", "distractors": [{"token": "a", "hint": "Americano는 모음 발음으로 시작해서 an을 써요", "for": "an", "kind": "form"}], "expected_errors": [], "glosses": [{"lemma": "keep it simple", "surface_form": "keeps it simple", "l1": "간단하게 하다"}], "explain": "고민 없이 늘 먹던 걸로 정할 때 쓰는 표현."}]}, {"line_id": "s1_l3", "elements": [{"span": "Actually, I might try that new caramel latte. It looks pretty good in the picture.", "l1": "사실, 저 새로 나온 카라멜 라떼 한번 먹어볼까 해요. 사진에서 보니까 꽤 맛있어 보여요.", "tokens": [{"t": "Actually", "l1": "사실", "free": true, "freeGroup": 1}, {"t": "I", "l1": "나"}, {"t": "might", "l1": "~할지도 모른다"}, {"t": "try", "l1": "시도해보다"}, {"t": "that", "l1": "저"}, {"t": "new", "l1": "새로운"}, {"t": "caramel", "l1": "카라멜"}, {"t": "latte", "l1": "라떼"}, {"t": "It", "l1": "그것은"}, {"t": "looks", "l1": "보이다"}, {"t": "pretty", "l1": "꽤"}, {"t": "good", "l1": "맛있는"}, {"t": "in", "l1": "~에서"}, {"t": "the", "l1": "그"}, {"t": "picture", "l1": "사진"}], "function": ["announce_intention"], "grammar": [], "discourse": ["hedge"], "level": "A2", "distractors": [{"token": "will", "hint": "확신이 아니라 '~할지도'라는 부드러운 예상이라 might가 맞아요", "for": "might", "kind": "nuance"}, {"token": "very", "hint": "'꽤'라는 뉘앙스라 pretty가 자연스러워요", "for": "pretty", "kind": "contrast"}], "expected_errors": [], "glosses": [{"lemma": "look good", "surface_form": "looks pretty good", "l1": "맛있어/좋아 보이다"}], "explain": "메뉴판 사진을 보고 새 메뉴를 시도해볼까 생각할 때 쓰는 표현."}]}, {"line_id": "s1_l4", "elements": [{"span": "Go for it. If it's bad, you can always blame the picture.", "l1": "한번 해봐요. 맛없으면 사진 탓하면 되죠, 뭐.", "tokens": [{"t": "Go", "l1": "가다"}, {"t": "for", "l1": "~을 향해"}, {"t": "it", "l1": "그것"}, {"t": "If", "l1": "만약"}, {"t": "it's", "l1": "그것은 ~이다"}, {"t": "bad", "l1": "나쁜/맛없는"}, {"t": "you", "l1": "당신"}, {"t": "can", "l1": "~할 수 있다"}, {"t": "always", "l1": "항상/언제든"}, {"t": "blame", "l1": "탓하다"}, {"t": "the", "l1": "그"}, {"t": "picture", "l1": "사진"}], "function": ["reassure"], "grammar": [], "discourse": [], "level": "A2", "distractors": [{"token": "was", "hint": "지금 시켜보라고 권하는 상황이라 현재형 it's가 맞아요", "for": "it's", "kind": "form"}], "expected_errors": [], "glosses": [{"lemma": "go for it", "surface_form": "go for it", "l1": "한번 해보다"}, {"lemma": "blame", "surface_form": "blame", "l1": "탓하다"}], "explain": "상대가 새로운 메뉴를 시도해볼지 망설일 때 가볍게 응원하며 부담을 덜어주는 말."}]}, {"line_id": "s2_l1", "elements": [{"span": "Hi there! What can I get started for you two?", "l1": "안녕하세요! 두 분 뭐 드릴까요?", "tokens": [{"t": "Hi", "l1": "안녕하세요"}, {"t": "there", "l1": "저기요"}, {"t": "What", "l1": "무엇을"}, {"t": "can", "l1": "~해드릴 수 있다"}, {"t": "I", "l1": "제가"}, {"t": "get", "l1": "가져다드리다"}, {"t": "started", "l1": "시작해서"}, {"t": "for", "l1": "~을 위해"}, {"t": "you", "l1": "당신들"}, {"t": "two", "l1": "두 분"}], "function": ["offer_help"], "grammar": [], "discourse": ["discourse_opener"], "level": "A1", "distractors": [], "expected_errors": [], "glosses": [{"lemma": "get started for", "surface_form": "get started for", "l1": "주문을 받다"}], "explain": "점원이 손님을 맞이하며 주문을 물어볼 때 쓰는 표현."}]}, {"line_id": "s2_l2", "elements": [{"span": "I'll have an iced Americano, please. Large, if that's okay.", "l1": "저는 아이스 아메리카노 주세요. 괜찮으면 큰 사이즈로요.", "tokens": [{"t": "I'll", "l1": "저는 ~할게요"}, {"t": "have", "l1": "먹다/주문하다"}, {"t": "an", "l1": "하나의"}, {"t": "iced", "l1": "아이스"}, {"t": "Americano", "l1": "아메리카노"}, {"t": "please", "l1": "부탁드려요"}, {"t": "Large", "l1": "큰 사이즈로"}, {"t": "if", "l1": "만약"}, {"t": "that's", "l1": "그게"}, {"t": "okay", "l1": "괜찮다"}], "function": ["polite_request"], "grammar": [], "discourse": ["hedge"], "level": "A2", "distractors": [{"token": "get", "hint": "주문할 때는 have를 많이 써요", "for": "have", "kind": "contrast"}], "expected_errors": [], "glosses": [{"lemma": "I'll have", "surface_form": "i'll have", "l1": "~로 주세요(주문 표현)"}], "explain": "카페나 식당에서 정중하게 주문할 때 쓰는 표현."}]}, {"line_id": "s2_l3", "elements": [{"span": "Sure thing. And for you?", "l1": "네, 알겠습니다. 손님은요?", "tokens": [{"t": "Sure", "l1": "그럼요"}, {"t": "thing", "l1": "물론이죠"}, {"t": "And", "l1": "그리고", "free": true, "freeGroup": 1}, {"t": "for", "l1": "~에게는"}, {"t": "you", "l1": "당신"}], "function": ["ask_preference"], "grammar": [], "discourse": ["topic_shift"], "level": "A1", "distractors": [], "expected_errors": [], "glosses": [{"lemma": "sure thing", "surface_form": "sure thing", "l1": "그럼요/알겠습니다"}], "explain": "주문을 확인하고 다음 사람에게 순서를 넘길 때 쓰는 표현."}]}, {"line_id": "s2_l4", "elements": [{"span": "Could I get the caramel latte? Medium size, please.", "l1": "카라멜 라떼 주시겠어요? 중간 사이즈로요.", "tokens": [{"t": "Could", "l1": "~해주시겠어요"}, {"t": "I", "l1": "제가"}, {"t": "get", "l1": "받다/주문하다"}, {"t": "the", "l1": "그"}, {"t": "caramel